LABEL,Date,Source,Title,Headline
Droughts,7/22/2023,Business Insider,A brewery is making beer with recycled wastewater purified using a process developed by NASA,company relies same recycling methods that NASA uses allow astronauts drink water space
Droughts,7/26/2023,Ars Technica,The Namibian fairy circle debate rages on Could it be sand termites after all,Study offers four point rebuttal claim that they kind Turing pattern
Droughts,7/7/2023,The Guardian,Why are people dying at sea They are fleeing disasters that we once called biblical and now call normal Fatima Bhutto,Many those drowned near Greece last month were escaping environmental crises Pakistan Across world there worse comeBefore Adriana overcrowded fishing trawler left Libya June Sajjad Yousef spoke father family
Droughts,7/6/2023,The Guardian,EU sets out first ever soil law to protect food security and slow global heating,Proposal improve soil health throughout continent criticised lack legally binding targetsThe European Commission proposed continent first soil intended undo some damage done intensive farming mitigate global
Droughts,7/16/2023,The Guardian,The Guardian view on a water crisis Uruguay points to a wider issue and to solutions Editorial,South American country running draw upon history social political organisation protect access Almost decades Uruguay world first country enshrine right clean water constitution
Droughts,7/8/2023,The Guardian,Climate scientist and politician Maisa Rojas You don t only take decisions based on evidence and science,Chile environment minister reconciling green goals realities government wants developing country global climate pioneerLast year renowned climate scientist Maisa Rojas left academic comfort zone
Droughts,8/4/2023,Business Insider,How a year old system of irrigation channels could help protect Spain from extreme heat,miles irrigation channels built between eighth centuries could solution dealing with increasing heat Spain
Droughts,7/15/2023,BBC News,John Kerry in Beijing Can US and China set aside rivalry for climate action,biggest economies polluters need work together avert crisis experts
Droughts,8/2/2023,Science Daily,Sea urchins are struggling to get a grip as climate change alters ecosystems,global climate change causes weather extremes ranging from heat waves droughts heavy rains flooding large amounts freshwater pouring into nearshore ecosystems altering habitats team biologists studied impacts salinit
Droughts,7/17/2023,The Guardian,New UK government plan to protect against climate heat very weak,Exclusive Leaked document falls short what needed safeguard lives livelihoods from heat drought storms expertsThe government plan cope with climate crisis been condemned very weak experts
Droughts,7/17/2023,Phys.Org,Droughts in Western states drive up emissions and threaten human health,When drought stricken rivers reservoirs across American West hydropower dries utilities fire hundreds power plants that burn coal natural keep with demand electricity timing couldn worse accom
Droughts,7/13/2023,New Scientist,Shifting where data is processed for AI can reduce environmental harm,scheduling algorithm help redistribute workloads among data centres minimise environmental impact regions experiencing water shortages fossil fuel pollution
Droughts,8/1/2023,Phys.Org,Spain worries over lifeless land amid creeping desertification,Ongoing droughts over exploitation land both agriculture industry have stoked fears Spain over creeping spread sterile soil which could devastate Europe kitchen garden
Droughts,7/18/2023,Phys.Org,Large fish more vulnerable to climate change induced fish kills study finds,Climate change induced droughts fish kills affect larger fish more severely than they affect smaller individuals according research
Droughts,7/28/2023,Phys.Org,Experts Expect worsening flooding and drought as rapid warming continues,rest world will vulnerable larger swings between flooding droughts global temperatures rise study found
Droughts,7/27/2023,Phys.Org,Drought hit N Africa turns to purified sea and wastewater,From Tunisia Morocco baked North Africa embarked building spree plants that purify wastewater climate change intensifies droughts water scarce region
Droughts,7/17/2023,USA Today,Russia pulls out of Ukraine grain deal threatening food shortages and higher prices,world imports nearly third wheat from Ukraine Russia With exports disrupted some nations could higher prices shortages
Droughts,8/4/2023,The Guardian,Antarctica s heatwaves are a warning to humanity and we have only a narrow window to save the planet Climate scientists,Antarctica levels plummeting extreme weather events happen faster than scientists predictedAntarctica currently experiencing dramatic changes unprecedented rates marked repeated extreme events These include circum Antarctic summer
Droughts,7/25/2023,Yahoo Entertainment,What are cloudbursts and is climate change making them more frequent,Last Saturday Mohammed Aslam working kitchen garden when heard fellow villagers shouting that water coming from nearby foothills
Droughts,7/16/2023,Yahoo Entertainment,Scientists concerned about unheard of conditions off the coast of England We could see mass mortality,will unnoticed
Droughts,7/7/2023,The Guardian,This year is set to be the hottest in history Congress must act now Bernie Sanders,there bold immediate action address climate crisis quality life that leaving kids very much questionThe last eight years have been eight hottest record This year track hottest year recorded
Droughts,7/31/2023,The Guardian,UK farmer donated k so Amazon Indigenous meeting could take place,Hylton Murray Philipson says contributed gathering Brazil because growing climate threatA last minute personal donation from climate concerned British farmer enabled meeting hundreds Brazil Indigenous people ahead Amazon
Droughts,7/15/2023,The Guardian,With our food systems on the verge of collapse it s the plutocrats v life on Earth George Monbiot,Climate breakdown crop losses threaten survival ultra rich find ever more creative ways maintain status quoAccording Google news search media more than stories this year about Phillip Schofield British
Droughts,7/28/2023,The Guardian,Hardcore landscaping how to grow a garden on sand gravel and concrete,Builders waste perfect base maintenance biodiverse front garden filled with drought tolerant flowers grasses fewer weeds Four years moved into terrace house Bristol hadn been touched years time warp
Droughts,7/21/2023,The Guardian,California resort extends ski season as rest of US west suffers from heatwaves,state snowpack full from winter storms melted while rest region bakes summer temperaturesWhile most California swelters through prolonged extreme heatwave Mammoth Mountain resort eastern Sierras announced
Droughts,8/1/2023,Phys.Org,Opinion No leg to stand on why the US must reconsider its stance on climate reparations,From rising levels longer more extreme droughts there overwhelming evidence that climate change occurring harsh realities climate change have developing countries which most vulnerable impacts push compensatio
Droughts,7/31/2023,Forbes,In Emergencies Breastfeeding Keeps Babies Alive,During humanitarian crises such conflicts severe droughts lifesaving importance breastfeeding more important than ever
Droughts,7/10/2023,Phys.Org,Addressing justice in wildfire risk management,frequency severity wildfires have become increasingly alarming recent years substantially effects climate change Rising global temperatures altered weather patterns prolonged droughts consequences climate change
Droughts,7/25/2023,Phys.Org,Petrified trees reveal Yellowstone geyser s ongoing battle with drought,Yellowstone Steamboat Geyser decades long spells brought history droughts study finds With global temperatures rise American West projected become drier Sustained drought this region could slow down
Droughts,7/8/2023,Yahoo Entertainment,Scientists are sounding the alarm about a dangerous problem that will soon affect billion people here s what to know,About million people already affected
Droughts,7/22/2023,Theecologist.org,Over grazing and desertification in the Syrian steppe root causes of war,Civil Syria result desertification ecologically fragile Syrian steppe writes Gianluca Serra process that began when former Bedouin commons were opened unrestricted grazing That wider ecological
Droughts,7/20/2023,Phys.Org,Climate science is catching up to climate change with predictions that could improve proactive response,Africa climate change impacts experienced extreme events like drought floods Through Famine Early Warning Systems Network which leverages expertise from science agencies universities private sector IGAD Climate Pred
Droughts,7/27/2023,Phys.Org,How forests can cut carbon restore ecosystems and create jobs,limit frequency severity droughts wildfires flooding other adverse consequences climate change nearly countries have committed Paris Agreement long term goal keeping global warming well below degrees Celsius Accordi
Droughts,8/3/2023,The Guardian,More in hope lessons from our tiny reforestation scheme in the Amazon,Four years become clearer that future forest climate crisis down politicsUntil moved Amazon assumed sapling would grow into tree long water sunshine decent soil starting realis
Droughts,7/17/2023,Google News,French tourism businesses are wary of customers drying up as droughts worsen Yahoo Life,French tourism businesses wary customers drying droughts worsen Yahoo Life
Droughts,7/28/2023,Space.com,Removing carbon from Earth s atmosphere may not fix climate change,Removing carbon from Earth atmosphere reverse devastating changes weather patterns vulnerable areas study suggests
Droughts,7/25/2023,The Guardian,Deadly global heatwaves undeniably result of climate crisis scientists show,Analysis makes clear human caused global heating destroying lives with worse come without sharp emissions cutsThe human caused climate crisis undeniably blame deadly heatwaves that have struck Europe recent weeks scientis
Droughts,7/15/2023,BBC News,Tailteann Cup final Down face Meath at Croke Park,Text updates Tailteann Final between Down Meath followed Dublin against Monaghan Ireland semi final Croke Park
Droughts,7/6/2023,Project Syndicate,Winning the Fight for Women s Land Rights,Gender inequality prevented female agricultural workers numerous countries from owning inheriting land that they cultivate Securing their rights will boost land restoration efforts develop long term resilience droughts increase food produ
Droughts,7/31/2023,Arduino.cc,This Nicla Vision based fire detector was trained entirely on synthetic data,ever warming planet thanks climate change greatly increasing wildfire chances because prolonged droughts being able quickly detect when fire broken vital responding while still containable stage majo
Droughts,8/4/2023,Associated Press,Bark beetles are eating through Germany s Harz forest,Tiny bark beetles have been causing havoc Germany Harz mountains eating away trees killing swaths spruce population hampering their ability take nutrients Drought made longer more intense climate change making
Droughts,7/17/2023,Project Syndicate,What the Climate Fight Is Really About,Floods droughts wildfires other deadly phenomena what make climate change costly that future higher average global temperatures inevitable managing problem well requires that tail extreme weather distr
Droughts,7/11/2023,Vox,The new abnormal The rise of extreme flooding briefly explained,Climate change contributing heavier precipitation major factor flooding throughout northeastern globe
Droughts,7/30/2023,The Guardian,Joy and defiance at gathering led by Amazonian chief Raoni Metuktire,Climate concerns prominent hundreds attend celebration chief nominal birthdayDuring world hottest month more than years Indigenous women children from over Brazil made their into last great holdouts
Droughts,7/24/2023,Phys.Org,Space geodetic observations help reveal variations in Earth s surface loads,Motion Earth surface mass including atmosphere oceans well hydrology glacier melting causes redistribution Earth surface loads deformation solid Earth variations gravity field
Droughts,7/31/2023,The Guardian,The lesson from the Greece wildfires The climate crisis is coming for us all Nesrine Malik,developed world needs shocked complacency about warming world unexpected effects that will followA surreal video filmed tourist most perfect location Greece last week posted show weekend trip turne
Droughts,7/6/2023,Vice News,Scientists Raise Alarm Over Risk of Synchronized Global Crop Failures,research exposes underestimated risk simultaneous global food supply shocks climate change
Droughts,7/13/2023,The Indian Express,Monsoon havoc in India How floods can be a valuable resource,prudent upgrade hydro infrastructure country that tools manage increased variabilities available time
Droughts,7/7/2023,The Guardian,European pond turtle could return to British rivers and lakes,Conservationists reintroduction reptile could contribute restoring ancient biodiverse wetlandsThe European pond turtle could swimming British rivers lakes again thanks crowdfunded campaign conservation scientists seek sites
Droughts,7/10/2023,Forbes,Why BLUE BIN Believes The Future Of The Wine Industry Rests On Bottle Packaging,weight bottles accounts wine carbon footprint Rubin Winery rethinking packaging with first premium wine packaged recycled plastic
Droughts,7/12/2023,CBC News,Climate change is taking a toll on farmers in Africa Here s how AI technology can help,team researchers Senegal developed artificial intelligence tool help farmers adapting changing climate
Droughts,7/6/2023,The Washington Post,Earth entering uncharted territory as heat records quickly shatter,Scientists brace more extreme weather probably record warm amid unprecedented temperatures
Droughts,7/25/2023,HuffPost,Opinion Climate Catastrophes Await Us And All Conservatives Can Do Is Embarrass Themselves,Republicans convinced that investments green energy saving Earth from global warming just devious works woke liberals
Droughts,7/21/2023,Biztoc.com,Grassroots Group Campaign Urges Viewers To Act Against Climate Change,read article recently that this season Canadian wildfires have burned record million acres shattering previous record with another month country wildfire season climate change culprit There definitive research
Droughts,7/11/2023,Forbes,How To Better Predict Hurricanes And Droughts For Oil Industry And Climate Change,genetic model improve predictions hurricane strength track landfall could also model predictions drought water stressed shale fields
Droughts,7/17/2023,Al Jazeera English,What s the latest on Canada s record wildfire season,second firefighter died wildfires continue burn leading quality advisories across North America
Droughts,7/11/2023,USA Today,Five NFL teams that could make the playoffs after postseason droughts in,Panthers Jets Lions Colts Browns Natalie Miller five teams might make playoffs after postseason droughts
Droughts,7/17/2023,Independent,French tourism businesses are wary of customers drying up as droughts worsen,After summer winter drought south France that record levels water some country pristine reservoirs tourism companies that rely water their businesses thrive wary future climate change make
Droughts,7/24/2023,Al Jazeera English,At least killed in Algerian wildfires during high heat winds,Thousands firefighters battle blazes about people forced evacuate
Droughts,7/17/2023,Yahoo Entertainment,French tourism businesses are wary of customers drying up as droughts worsen,SAINTE CROIX VERDON France pristine southern French lake Sainte Croix Verdon tourists pedal boats white water rafts
Droughts,7/27/2023,Phys.Org,Italian scientists urge media to better explain climate change,Nearly Italian scientists wrote open letter media Thursday urging better reporting causes solutions climate change steps taken avert crisis
Droughts,8/1/2023,Phys.Org,Two day holiday in Iran over extreme heat,Iran Tuesday declared holiday government workers banks nationwide searing temperatures sweep across country state media reported
Droughts,8/3/2023,Phys.Org,Do phrases like global boiling help or hinder climate action,Last week United Nations General Secretary Guterres coined arresting term global warming ended declared dramatically global boiling arrived
Droughts,7/18/2023,Forbes,Here s Why Flooding Could Get More Intense As Planet Warms As Northeast U S Recovers From Brutal Rain,Rain events such ones that happened Northeast over past week become more common climate change
Droughts,7/13/2023,Space.com,What are El Ni o and La Ni a and how do they affect Earth s weather,significantly impact Earth weather patterns explore events more detail here take look they impact Earth weather
Droughts,7/30/2023,Worldsensorium.com,The Power of Weeds to End Hunger in an Uncertain Climate,Power Weeds Hunger Uncertain Climate Lewis Ziska Sign monthly newsletter Hang Aren weeds harmful crops constraint ability grow enough food they always European wine
Droughts,7/20/2023,Phys.Org,A roundup of the extreme heat hitting the globe,world been buffeted fires dire health warnings broken temperature records past week
Droughts,7/25/2023,CBS Sports,NFL teams with longest playoff droughts ranking chances they end in Jets Lions primed for postseason,Jets Lions appear their playoff droughts
Droughts,7/30/2023,Yahoo Entertainment,Shortage of cult classic kitchen staple continues amid severe droughts Unless there is rain there won t be a crop,Bottles cult favorite sauce appearing secondary market
Droughts,7/31/2023,Al Jazeera English,Rain to bring brief respite to Phoenix after record heatwave scalds US city,Arizona capital grappling with high temperatures neighbouring California contends with wildfires
Droughts,7/28/2023,Google News,Yellowstone s geysers at risk of extinction from climate change tree skeletons reveal Livescience com,Yellowstone geysers risk extinction from climate change tree skeletons reveal Livescience Yellowstone Steamboat Geyser battled with droughts centuries Earth Petrified trees reveal Yellowstone geyser ongoi
Droughts,7/28/2023,Politicopro.com,Is A Mega ocean Current About to Shut Down,alarming study predicts imminent collapse some experts evidence insufficient
Droughts,7/25/2023,Phys.Org,Algeria battles wildfires that have killed,Algerian firefighters Tuesday battled blazes that have killed people across tinder north destroyed homes coastal resorts turned vast forest areas into blackened wastelands
Droughts,8/1/2023,Phys.Org,Nature based solutions can help tackle climate change and food security but communities outside Europe are missing out,Nature based solutions help grand challenges such climate change food security things stand communities outside Europe stand benefit from these innovations research from University Surrey found that
Droughts,8/4/2023,Phys.Org,Discarded plastic blights Honduran mangrove island,heron chick flutters clumsily after hatching nest mangrove island littered with plastic waste Gulf Fonseca along Pacific Coast Central America
Droughts,7/12/2023,Politicopro.com,Climate Change Could Stump AI Weather Prediction,Artificial intelligence taps historical weather data forecasting changing climate complicating nbsp such nbsp efforts
Droughts,8/4/2023,Scientific American,The Fungi Economy Part Just Like Us Trees Are Experiencing Inflation,Like plants fungi have complex economies burning fossil fuels rsquo been devaluing their currency
Droughts,7/25/2023,The Guardian,Murray Darling Basin plan Labor gives states more time to deliver water pledges despite El Ni o fears,Environment minister Tanya Plibersek declined federal government will power back more water Follow Australia news live blog latest updates morning afternoon news emails free daily
Droughts,7/18/2023,Telegraph.co.uk,Weather latest Italy prepares for C during peak of Europe s hottest ever week,
Droughts,7/18/2023,The Guardian,All that we had is gone my lament for war torn Khartoum Nesrine Malik,Since Sudan capital engulfed violence April life there been destroyed tried family members safety ruination former home became hard fathomWe thought would last most When sound
Droughts,7/12/2023,Breitbart News,Ice Cube Torches Artificial Intelligence It s the Worst Sh t Ever,Rapper Hollywood star Cube upped anti establishment bona fides this week excoriated artificial intelligence tool that will essentially lead laziness creative droughts
Droughts,7/10/2023,Grist,How the Western drought has increased carbon emissions,hydropower dams coal natural have stepped
Droughts,7/7/2023,Telegraph.co.uk,The South American capital with a week s worth of water left,Workers have begun drilling wells capital reach water beneath ground while protests have erupted over shortages
Droughts,8/1/2023,Live Science,Will the US run out of water,issue about running water about having water right place Mullin Bernhardt from United Nations Environment Programme UNEP told Live Science
Droughts,7/27/2023,Psychology Today,Could Scheduling Sex Kill My Relationship,Planned intimacy sound like relationship killer could could also relationship saver
Droughts,8/1/2023,International Business Times,Spain Worries Over Lifeless Land Amid Creeping Desertification,Ongoing droughts over exploitation land both agriculture industry have stoked fears Spain over creeping spread sterile soil which could devastate Europe kitchen garden
Droughts,7/24/2023,The Guardian,Algeria wildfires kill dozens of people including soldiers,About firefighters trying bring blazes under control people evacuates heatwave hitsTen soldiers among people have been killed wildfires mountainous Bouira regions Algeria heatwave spreads across
Droughts,7/19/2023,Forbes,Modern Sixth Mass Extinction Event Will Be Worse Than First Predicted,report argues that almost half planet animal species decline unlike past mass extinctions this been entirely caused humans
Droughts,7/27/2023,Forbes,The Art Featured In This Year s National Climate Assessment Report,Alongside overview current science climate change upcoming National Climate Assessment report will feature climate inspired
Droughts,7/20/2023,Forbes,Rivers As Weapons Of War And Warnings Of Climate Change Part,millennia armies have used rivers weapons While these were intentional disasters they same ones that will become more likely with climate change
Droughts,7/21/2023,Science Daily,Climate science is catching up to climate change with predictions that could improve proactive response,Africa climate change impacts experienced extreme events like drought floods been possible predict monitor these climatic events providing early warning their impacts agriculture support humanitarian resilience
Droughts,7/15/2023,Home.blog,Loops and Arcs,Here tools been using lately better understand functionality game designs first loop structure that should very familiar those have looked
Droughts,7/24/2023,Phys.Org,Algeria fires fanned by winds extreme heat kill,Wildfires raging across Algeria during blistering heat wave have killed more than people forced mass evacuations government said Monday
Droughts,8/3/2023,Phys.Org,Geostationary satellite reveals widespread midday depression in dryland photosynthesis during heat wave,western particularly Southwest experienced notable increase record breaking high temperatures over recent decades with recurring drought heat waves These conditions have resulted severe consequences both human nature
