LABEL,Date,Source,Title,Headline
Heatwave,7/19/2023,BBC News,Heatwave Italy s major cities on red heat alert,Parts Sardinia Sicily will hottest Europe with highs
Heatwave,7/15/2023,BBC News,Europe heatwave Red alerts issued in Italian cities,Health warnings Rome elsewhere come extreme weather scorches southern central Europe
Heatwave,7/18/2023,BBC News,Heatwave hits homeless people I cry all the time,Homeless people reportedly make half heat associated deaths
Heatwave,7/26/2023,Google News,Heatwave Where are the hottest spots in the US Reuters,Heatwave Where hottest spots Reuters
Heatwave,7/16/2023,Google News,US heatwave high temperatures forecast northeast braces for rain Reuters,heatwave high temperatures forecast northeast braces rain Reuters
Heatwave,7/15/2023,Google News,Extreme heat kills expert on U S heatwave Reuters,Extreme heat kills expert heatwave Reuters
Heatwave,7/14/2023,Google News,Europe heatwave Just how bad is it Reuters com,Europe heatwave Just Reuters
Heatwave,7/17/2023,Google News,Texas power use hits record high as heatwave lingers Reuters,Texas power hits record high heatwave lingers Reuters
Heatwave,7/19/2023,Google News,Europe battles heatwave and fires record temperatures scorch China Reuters com,Europe battles heatwave fires record temperatures scorch China Reuters
Heatwave,7/18/2023,Google News,As heatwave bakes Europe Paris keeps eye on weather models Reuters,heatwave bakes Europe Paris keeps weather models Reuters
Heatwave,7/21/2023,Google News,Wildfires in Greece burn for fifth day as another heatwave hits Reuters com,Wildfires Greece burn fifth another heatwave hits Reuters
Heatwave,7/24/2023,Google News,Wildfires kill in Algeria as heatwave sweeps north Africa Reuters com,Wildfires kill Algeria heatwave sweeps north Africa Reuters
Heatwave,8/4/2023,Google News,South Korea scrambles to ensure safety of scout jamboree in heatwave Reuters,South Korea scrambles ensure safety scout jamboree heatwave Reuters
Heatwave,7/12/2023,Google News,Texas power demand hits record more highs seen in heatwave Reuters,Texas power demand hits record more highs seen heatwave Reuters
Heatwave,8/3/2023,Google News,Safety concerns mount for scout gathering amid South Korea heatwave Reuters,Safety concerns mount scout gathering amid South Korea heatwave Reuters
Heatwave,8/4/2023,Google News,US Scouts to pull out of heatwave hit jamboree in South Korea Reuters,Scouts pull heatwave jamboree South Korea Reuters
Heatwave,7/22/2023,The Guardian,Heatwave set to be Greece s longest as extreme weather continues in Europe,Country braces hottest July weekend years firefighters battle forest blazesThe heatwave engulfing Greece expected longest country history with temperatures forecast reach year high July this weekend Kostas
Heatwave,7/20/2023,The Guardian,Extreme weather continues across Europe as further heatwave looms,Temperatures remain high hailstorms northern Italy with fourth heatwave forecast southern Europe next weekHailstorms have northern Italy near record temperatures begin forecasters have warned fourth heatwave hitting sout
Heatwave,7/20/2023,The Guardian,Europe heatwave fails to deter holidaymakers as easyJet demand booms,frills carrier reports record quarterly profit rebound travel industry gathers paceHolidaymakers being deterred ongoing heatwave Europe travellers continue their summer vacations amid booming demand trave
Heatwave,7/27/2023,The Guardian,More than m Americans under heat alerts as heatwave expands,Between million will face heat indexes heatwave moves into parts Great Plains midwest north eastOver million Americans under heat alerts this week according National Weather Service heat wave that affect
Heatwave,8/3/2023,The Guardian,Winter is disappearing South America hit by brutal unseasonal heatwave,Buenos Aires records hottest start August years Chile sees highs towards Bolivia Paraguay Brazil also bakeNow should South America bleak midwinter several parts continent experiencing extraordinary unseasonal
Heatwave,7/9/2023,BBC News,How warming oceans are driving the climate juggernaut,Experts predicting that developing likely make world hottest year
Heatwave,7/16/2023,Google News,I am worried about my health British holidaymakers fear heatwave in Europe The Guardian,worried about health British holidaymakers fear heatwave Europe GuardianView Full coverage Google News
Heatwave,7/25/2023,BBC News,Greece fires Satellite images and maps show extent of damage,Maps satellite images before after pictures show extent wildfires across Greece
Heatwave,7/22/2023,Slashdot.org,There s a Heatwave In the Sea and Scientists Are Worried,anonymous reader quotes report from month June first days July were hotter than recorded history according World Meteorological Organization Residents south southern Europe have
Heatwave,7/19/2023,Business Insider,Beat the heat wave with one of the best portable air conditioners and save,Heatwave records being broken every year have conditioner this deal portable model keeps cool beyond
Heatwave,7/21/2023,The Guardian,From Kawasaki to Phoenix tracking a day of extreme heat around the world,extreme temperatures challenge records across globe chart life heatwave from morning Japan evening United States Continue reading
Heatwave,7/25/2023,The Guardian,How bad are the wildfires in Greece and what caused them A visual guide,Fatal heatwave southern Europe conditions have fuelled spread firesRoaring fires have ripped through Greece belching thick clouds choking smoke forcing tens thousands people flee Continue reading
Heatwave,8/4/2023,The Guardian,Tell us your experience of the World Scout Jamboree in South Korea,heatwave event which sees more than young people from countries gather build friendships experience other culturesThe World Scout Jamboree being held South Korea attracting tens thousands Scouts from around
Heatwave,8/4/2023,The Guardian,A bit horrific Scouts at jamboree in South Korea on campsite conditions,Scouts being moved Seoul hotels after heatwave caused chaos medical issues horrific said Sophie attender from World Scout Jamboree Buan South Korea which been plagued challenges resulting from prolo
Heatwave,8/3/2023,Google News,BBC weather announces exact date summer will return to UK after weeks of rain Chronicle Live,weather announces exact date summer will return after weeks rain Chronicle Live weather Exact date heatwave bake Britain sunshine will return August News Office forecast rest August
Heatwave,7/20/2023,VentureBeat,Oracle MySQL Heatwave Lakehouse goes GA to query data,Oracle staking claim data lakehouse business while continuing augment ongoing generative efforts
Heatwave,7/19/2023,The Guardian,Europe heatwave what should you do about travel plans across the continent,Sweltering temperatures wildfires leaving holidaymakers edge insurers every scenarioAs temperatures southern Europe remain high many holidaymakers soon will wondering whether they still want travel
Heatwave,7/31/2023,The Guardian,People are dying Texas prisoners say heatwave turns cells into ovens,State prisons crisis point with temperatures regularly above threatening physical mental health inmatesIn Texas animal shelters obliged ensure that their ambient temperature does rise above more than hours
Heatwave,7/16/2023,The Guardian,Thousands forced out of their homes on La Palma as heatwave grips Europe,Forest fire sweeps across Canary island continent braces hottest temperatures ever recordedMore than people have been evacuated Canary island Palma after forest fire swept through north west island Europe continues
Heatwave,7/14/2023,The Guardian,European heatwave to lead to mph wind gusts in UK warns Met Office,Sweltering temperatures Europe directing pressure systems towards yellow wind warning placeSweltering temperatures Europe directing pressure systems towards will lead gusts heavy rain this weekend
Heatwave,7/17/2023,The Guardian,Weather tracker temperatures to intensify in Europe as new heatwave hits,Spain Italy Greece parts Balkans worst affected with some areas braced possible conditionsIn contrast rather cool unsettled unseasonably windy weather large parts southern Europe grip intense
Heatwave,7/21/2023,BBC News,Climate records tumble leaving Earth in uncharted territory scientists,series records temperature ocean heat Antarctic unprecedented some scientists
Heatwave,7/17/2023,The Guardian,Italian media more focused on foreign coverage of heatwave than its effects,Climate crisis still lacks depth analysis after years ridicule rightwing factions press experts sayItaly sweltering abnormally high temperatures media appears more intrigued extreme heat being reported
Heatwave,8/4/2023,The Guardian,UK children to move to Seoul hotels as heatwave hits World Scout Jamboree,Thousands Scouts removed from site after hundreds heat related illnesses event South KoreaThousands Scouts attending World Scout Jamboree South Korea being removed from jamboree site south western county Buan
Heatwave,7/16/2023,BBC News,Extreme heat intensifies across south west US,More than dozen states under warnings with brutal conditions showing sign abating
Heatwave,7/6/2023,The Guardian,Heatwaves keep paramedics busy as cardiovascular complaints shoot up,German study finds ambulance callouts increased third when average temperatures CThe hotter weather busier paramedics become study carried German city rzburg found that ambulance callouts cardiovascular complaints
Heatwave,8/3/2023,Google News,Hundreds fall ill at scout event in South Korea heatwave The Independent,Hundreds fall scout event South Korea heatwave Independent World Scout Jamboree Hundreds heat exhaustion Korea Hundreds suffer heat exhaustion World Scout Jamboree South Korea Guardian News
Heatwave,7/17/2023,The Guardian,New UK government plan to protect against climate heat very weak,Exclusive Leaked document falls short what needed safeguard lives livelihoods from heat drought storms expertsThe government plan cope with climate crisis been condemned very weak experts
Heatwave,7/20/2023,The Guardian,Ex meteorologist names US heatwaves after oil and gas firms to shame them,People need riled says Walton already christened previous heatwaves this summer Amoco BPThe summer heatwaves have been blistering they have inspired their names Europe they have been called nightmarish figures
Heatwave,7/17/2023,The Guardian,Extreme temperatures recorded across northern hemisphere,Alerts issued Italy China wildfires rage Greece temperature California Death Valley nears global record Extreme heatwave latest news updates Temperatures continued reach extreme highs across many parts northe
Heatwave,7/18/2023,The Guardian,Consider the heatwave and floods can we still save the planet for our children I think we can Gaia Vince,easy despair leave geographical epoch enter another situation dire address itLand temperatures have Spain satellite data shows with tourists warned stay beaches throughout Mediterranean Across
Heatwave,7/22/2023,The Guardian,How deadly are these heatwaves and how hot will they get,record breaking temperatures planet stresses body include heatstroke heart kidney lung diseaseHeat silent killer When gets heart pumps faster blood races organs begin fail stress overwhelms
Heatwave,7/22/2023,The Guardian,Greece faces hottest July weekend in years forecaster says as scores of wildfires rage,Tourism sites including Acropolis close during hottest parts temperatures remain over CGreece endure hottest July weekend years meteorologist warned country wilts under prolonged heatwave
Heatwave,8/4/2023,BBC News,Ocean heat record broken with grim implications for the planet,oceans vital regulator climate weather rapidly heating
Heatwave,7/28/2023,Boing Boing,The latest right wing conspiracy theory is that the heatwave isn t real,America much world baking record temperatures Americas under local heat alerts seawater Florida hitting degrees more Hikers dropping dead Arizona Greece fire July hottest month
Heatwave,7/28/2023,The Guardian,Most fires in Greece were started by human hand government says,Official blames arsonists majority blazes that have spread extreme weatherMost fires that have erupted across Greece recent weeks were started human hand country senior climate crisis official said
Heatwave,7/25/2023,The Guardian,Deadly global heatwaves undeniably result of climate crisis scientists show,Analysis makes clear human caused global heating destroying lives with worse come without sharp emissions cutsThe human caused climate crisis undeniably blame deadly heatwaves that have struck Europe recent weeks scientis
Heatwave,7/17/2023,The Guardian,South East Water reports m loss after year of extreme weather,Water firm says dealing with record breaking heatwave other weather events cost mSouth East Water reported loss nearly which blamed part cost dealing with last year extreme weather events including
Heatwave,7/13/2023,The Guardian,UK butterfly count could show fall in numbers after drought,annual three week survey kicks there signs weather taken toll populations common speciesLast summer drought have reduced butterfly populations this year because grasses flowers that would usually feed caterpillars withered
Heatwave,7/19/2023,The Guardian,No let up in Phoenix as extreme temperatures persist,Emergency room doctor treating heatstroke victims with large amounts Arizona city enters ninth lows above FWith immediate anticipated scorching heat over American south west where temperatures have reached more than
Heatwave,7/31/2023,The Guardian,Huge wildfire explodes in southern California and spreads into Nevada,York fire with zero containment Sunday evening major blazes burning California region faces weatherA huge wildfire burning control California Mojave national preserve spreading rapidly amid erratic winds York
Heatwave,7/11/2023,BBC News,What do heatwaves do to the body and who is most at risk,Heat been spiking Canada What impact high temperatures have bodies
Heatwave,8/2/2023,BBC News,Rhodes fires Free holiday for evacuated tourists Greek PM says,Greek encouraged tourists return island generosity after wildfires
Heatwave,7/22/2023,BBC News,Greece fires Thousands flee homes and hotels on Rhodes as fires spread,Greece deputy fire chief says fires most difficult service currently facing
Heatwave,7/18/2023,Google News,Extreme heatwave live Rome braced for record C heat second day of US China climate talks begins The Guardian,Extreme heatwave live Rome braced record heat second China climate talks begins Guardian calls urgent action climate crisis China talks Jazeera English Climate envoy John Kerry meets with
Heatwave,8/4/2023,Google News,World Scout Jamboree In Disarray As Hundreds Of Teens Fall Ill Amid Intense South Korean Heatwave Forbes,World Scout Jamboree Disarray Hundreds Teens Fall Amid Intense South Korean Heatwave Forbes Korea heat wave Canadians Scout Jamboree News British scouts leave South Korean Jamboree site after
Heatwave,7/25/2023,InsideClimate News,Climatologists July s intense heat exactly what we expected to see,Deadly temperatures will become common unless greenhouse emissions fast
Heatwave,8/1/2023,BBC News,Thirsty and exhausted Texans feel the heatwave,Concern mounting workers across Texas unable avoid scorching temperatures
Heatwave,8/5/2023,Google News,US UK scouts quit World Scout Jamboree campsite in Korea over extreme heat Al Jazeera English,scouts quit World Scout Jamboree campsite Korea over extreme heat Jazeera English Korea heat wave Canadians Scout Jamboree News Heatwave jamboree Korea doubt American scouts leave Reuter
Heatwave,7/17/2023,Google News,Much of Europe U S grapple with scorching temperatures CBC ca,Much Europe grapple with scorching temperatures Heat wave bakes southern Europe sparking warnings stay inside drink water limit exercise Globe Mail Extreme heatwave intensifies across Europe
Heatwave,7/12/2023,BBC News,Cerberus heatwave Hot weather sweeps across southern Europe,heatwave could potentially lead record breaking temperatures forecasters
Heatwave,7/19/2023,The Guardian,This heatwave is a climate omen But it s not too late to change course Michael E Mann and Susan Joy Hassol,warming planet including most date data entirely consistent with what climate modelers warned decades agoThirty years world nations agreed prevent dangerous human interference with climate system
Heatwave,7/18/2023,Time,Phoenix s Relentless Heatwave Poised to Break a Record for American Cities,Phoenix streak dangerously days poised smash record major cities Tuesday temperatures soar
Heatwave,7/15/2023,The Guardian,Firefighters battle California wildfires amid blistering heatwave,Three brush fires burning rural areas across Riverside county where homes under evacuation ordersFirefighters southern California were battling three separate brush fires that started Friday afternoon amid blistering heatwave fires
Heatwave,7/21/2023,The Guardian,Rampant heatwaves threaten food security of entire planet scientists warn,After hottest ever researchers global heating mean future crop failures land silent dying oceansSuccessive heatwaves threaten nature ability provide with food researchers they warn unseen silent dying
Heatwave,7/22/2023,The Guardian,A horrible way to die extreme heat in Italy takes workers lives as temperatures pass C,Factory workers labourers call furlough heat becomes intense work inStefano Olmastroni cleaner been tidying shelves supermarket selling farm produce Florence shortly before died July when Italy midst
Heatwave,7/7/2023,BBC News,Hail batters Spanish towns creating icy urban flows,Storms country battering areas north south with hail days after heatwave
Heatwave,7/15/2023,The Guardian,I ve never seen heat this bad It s not normal Italy struggles as temperature tops C,Anticyclone Caronte could send thermometer Mediterranean heatwave intensifies Read more Acropolis closes protect touristsA fierce anticyclone named after Cerberus three headed monster that features Dante Inferno even
Heatwave,7/17/2023,The Guardian,Drone footage shows extent of wildfires in Spain s La Palma video,Drone footage released firefighters Canary Islands shows raging wildfires island Palma amid extreme heatwaves worldwide Europe expected reach hottest ever temperature with wildfires recorded across Spain Turkey Croatia
Heatwave,7/21/2023,The Guardian,Soaring temperatures may signal the decline of summer holidays to the Mediterranean,Tourists choosing milder destinations such Ireland Denmark heatwave over southern Europe leads temperatures SpainRepeated heatwaves growing fears about climate crisis spell beginning
Heatwave,7/11/2023,The Guardian,Everyone loved ngel Spanish town still grieving for hero who fought wildfires,fresh heatwave hits Spain bara residents remember heroics lost life blaze last yearThe smoke grey skies over bara were turning furnace orange ngel Mart forced down sandwich that been pressed friends
Heatwave,7/17/2023,BBC News,Watch How hot will it get in southern Europe heatwave,Weather latest temperatures intensify countries including Spain Italy
Heatwave,7/18/2023,BBC News,US heatwave sees hospitals use body bag ice treatment,Hospitals influx patients suffering extreme effects heat hits Phoenix
Heatwave,7/14/2023,Slashdot.org,Europe Braces for Sweltering July,Temperatures sizzling across Europe this week amid intense prolonged period heat only just begun From report Italy Spain France Germany Poland facing major heatwave with temperatures expected climb
Heatwave,7/21/2023,BBC News,There s a heatwave in the sea and scientists are worried,Could warmer ocean temperatures sign climate change progressed further than thought
Heatwave,7/25/2023,BBC News,US lawmaker Greg Casar begins thirst strike over heat laws,Greg Casar protest comes ahead rule change that will some protection outdoor workers
Heatwave,7/18/2023,The Guardian,Wildfire rips through California valley as seen in timelapse video,CCTV cameras captured wildfire ripping through valley California state experienced record high temperatures during heatwave that began scorching region last week Firefighters continued battling large brush blaze nicknamed Rabbit
Heatwave,7/9/2023,The Guardian,It s not just the Bank of England feeling the heat from wrong forecasts Torsten Bell,Economists failing predict levels inflation enough deadly when weather forecasters miss markEconomic forecasting having good time Inflation consistently come higher than expected governor Bank Engla
Heatwave,7/22/2023,The Guardian,More than people forced to flee wildfires on Greek island of Rhodes,Britons among those evacuated from hotels homes strong winds sweep blaze towards coastMore than people were forced flee their homes hotels Rhodes after uncontrolled wildfire swept across Greek island Saturday fire been
Heatwave,8/4/2023,Boing Boing,World sea surface temperature record broken,just Florida According European Union world average global surface temperature last month breaking record water feels like bath when jump says Kathryn Lesneski moni
Heatwave,7/28/2023,The Guardian,Blistering US heatwave spreads from south and scorches m Americans,Great Plains midwest Atlantic north east soaring temperatures with York City reach blistering heatwave that engulfed southern over past four weeks spread Great Plains midwest Atlantic
Heatwave,7/27/2023,The Guardian,Southern Europe and north Africa count heavy cost of wildfires,extreme heat recedes Italy Greece Portugal Spain Algeria reflect lives lost environmental damage costs livelihoodsAfter more than week fierce wildfires once again southern Europe counting heavy costs livelihoods
Heatwave,7/16/2023,Fort Worth Star-Telegram,Can you sunbathe naked or skinny dip in your own yard Here s what Texas state law says,Fort Worth heatwave have stay cool taking your clothes option
Heatwave,8/3/2023,Business Insider,A Lufthansa pilot traced a mile long penis shape in the sky after being asked to divert his plane,After Lufthansa pilot asked divert their aircraft they spent minutes doing loops shape penis over Sicily east coast
Heatwave,7/25/2023,Boing Boing,Two firefighting pilots die while battling a wildfire in Greece,firefighting plane battling wildfire Greece crashed island Evia only starting another fire tragically killing both pilots crash caught video shown below From Cross water bombing plane crashed while
Heatwave,7/11/2023,The Guardian,Uncharted territory UN declares first week of July world s hottest ever recorded,Extreme temperatures break records scientists warn worseThe beginning July hottest week record planet whole according World Meteorological Organization This year already seen hottest June
Heatwave,7/21/2023,The Guardian,Brutal heat and heavy rain a week of extreme weather,Temperatures reached high flooding South Korea India remote township north western region Xinjiang Chinese record Sunday country that battling weather months Sanba
Heatwave,7/21/2023,The Guardian,Hot streak US heatwaves lasting longer as record temperatures bake south west,Phoenix Californian town Needles experiencing where temperatures have reached brutal heatwave persisting throughout much with cities across south west reaching time records hottest consecutive days Intense heatw
Heatwave,7/18/2023,The Guardian,Phoenix s unhoused residents suffer through record heat even at night,Only cooling center remains open night when concrete radiates heat stored during hellish daytime hoursEven after sinks below horizon Phoenix Arizona concrete cityscape continues cook midst record breaking heat
Heatwave,7/23/2023,The Guardian,Blistering temperatures at the US Mexico border test people s mettle,border region sizzles Mexicans Americans alike carry through heatPeople withered blistering heat both sides Mexico border where temperatures scorching highs this week many little relief from
Heatwave,8/4/2023,The Guardian,Antarctica s heatwaves are a warning to humanity and we have only a narrow window to save the planet Climate scientists,Antarctica levels plummeting extreme weather events happen faster than scientists predictedAntarctica currently experiencing dramatic changes unprecedented rates marked repeated extreme events These include circum Antarctic summer
Droughts,7/25/2023,Google News,Factbox Europe sees another year of droughts and wildfires Reuters,Factbox Europe sees another year droughts wildfires Reuters
Droughts,7/21/2023,Wired,This Startup Wants to Give Farmers a Closer Look at Crops From Space,company cofounded astrophysicist combines with radar satellite imagery keep track vegetation eventually make forecasts about growth
Droughts,7/25/2023,Wired,Coming Soon Near You Bears,Extreme heat other weather events driving bears closer humans campgrounds hiking trails that good either species
Droughts,7/26/2023,Business Insider,Climate change is killing off a vital ocean current system and it could spark permanent droughts and extreme winters scientists say,system collapse could lead permanent drought Western Africa extreme winters Western Europe other weather disasters experts
Droughts,7/21/2023,The Guardian,Smart water meters will reveal true cost of waste and leaks in UK,Devices will tell people which their habits costing money enable water firms locate leaksFor long time piped water into homes been taken granted Even advent compulsory water meters some parts Britain been bonus
Droughts,7/19/2023,The Guardian,We are damned fools scientist who sounded climate alarm in s warns of worse to come,James Hansen testified Congress global heating says world approaching climate frontier world shifting towards superheated climate seen past years prior human existence because damned fools
